time,content,comments,retweets,quotes,hearts
2016-09-29 16:14:00,.@SteveEasterbrk Happy Anniversary of #AllDayBreakfast -my McMuffin from Sunday,0.0,0.0,0.0,0
2016-09-29 15:59:00,".@SteveEasterbrk My wife, Lisa, and I said we need a treat, we need Mcmuffins. We were as ecstatic as always when we had them!",,,0.0,0
2016-09-29 15:56:00,If you have questions for Chuck Robbins of Cisco $CSCO please pass them on!  @MadMoneyOnCNBC,0.0,0.0,0.0,0
2016-09-29 14:51:00,We should be worrying about everything,0.0,0.0,0.0,0
2016-09-29 14:30:00,Oil companies long-term fighting history...,0.0,,0.0,0
2016-09-29 14:29:00,CAT evolving into a bad short,,,0.0,0
2016-09-29 14:28:00,Spread the word!!,0.0,,0.0,0
2016-09-29 14:14:00,ill-advised tweet. I am not recommending Tesla. stay focused,0.0,,0.0,0
2016-09-29 14:14:00,Apache: Kamich— pull the trigger?,0.0,0.0,0.0,0
2016-09-29 14:10:00,Here it is: what Buffett thinks of $WFC stock. Must read from @DougKass,0.0,,0.0,0
2016-09-29 13:43:00,then where are the indictments?,0.0,0.0,0.0,0
2016-09-29 13:43:00,I love the British accent amid the congressionals..,,0.0,0.0,0
2016-09-29 13:42:00,totally,,,0.0,0
2016-09-29 13:42:00,as we used to say on the trading desk: Amazon has to get where it has to go!,0.0,0.0,0.0,0
2016-09-29 13:41:00,David's always trying to get me to be more in the now,0.0,,0.0,0
2016-09-29 13:41:00,sorry that I did so much homework. I like to be prepared. Wont happen again until tomorrow,0.0,,0.0,0
2016-09-29 13:40:00,We need to do this show while spinning,0.0,,0.0,0
2016-09-29 13:40:00,we are getting uber-mindful here,,,0.0,0
2016-09-29 13:39:00,"I had a ""cramer"" which is a triple vente cap with skim wet",0.0,0.0,0.0,0
2016-09-29 13:29:00,.@SteveEasterbrk Delicious McMuffin this weekend in Hazleton Pa! Good dividend boost too,,,0.0,0
2016-09-29 13:16:00,".@WilfredFrost Kimpton? Oh my, how the mighty have stumbled..",,,,0
2016-09-29 13:00:00,.@ValaAfshar That's why Twitter helps me,0.0,,0.0,0
2016-09-29 12:59:00,.@cj_wentz  Pennsylvania white tail??,0.0,,0.0,0
2016-09-29 12:57:00,.@WilfredFrost down or plane down? Motel 6 or Four Seasons?,,,0.0,0
2016-09-29 12:19:00,"3 for 3 on eps: $CAG, $PEP, $ACN--pretty amazing for a day...",0.0,,0.0,0
2016-09-29 12:16:00,".@Fantasy_Guru , @evansilva Dixon stashed for week 5? No way plays this week?",,,0.0,0
2016-09-29 12:01:00,.@DeSeanJackson11 you know we still love you and miss you in Philly. Thanks for all of those great years.,,,0.0,0
2016-09-29 12:00:00,.@ManusCranny You have to predict that we did it better in the U.S.,0.0,0.0,0.0,0
2016-09-29 12:00:00,because the fundamentals are not as good as Tweeters think they are.,,,0.0,0
2016-09-29 11:59:00,Just picked up Smith as per the genius of @evansilva .Chiefs D looked great.. You can air it out against Steeler secondary.,,,0.0,0
2016-09-29 11:36:00,"done, thanks!",,,,0
2016-09-29 11:32:00,.@evansilva Eli over Dak now without Dez even with Vike D?,0.0,,0.0,0
2016-09-29 08:47:00,doing it for you!,,,0.0,0
2016-09-29 08:45:00,kid's got horse sense,0.0,,0.0,0
2016-09-29 08:44:00,It's 4:43 a.m. and you made my day with this one!,0.0,,0.0,0
2016-09-29 08:43:00,When you call as many ceos clowns as i do in a given week i think my ambassadorial traits are overrated,0.0,,0.0,0
2016-09-29 08:41:00,"I like what $APA is doing. I also like $PXD, $EOG and $APC",0.0,,0.0,0
2016-09-29 02:55:00,My first love was always to write. I did a gazillion drafts of Confessions of a Street Addict. Thank you!!,0.0,0.0,0.0,0
2016-09-28 23:23:00,Alphabet’s not dead yet!,0.0,,0.0,0
2016-09-28 23:18:00,NY Times doing a lot of good articles about mindfulness these days.. at last..,,0.0,0.0,0
2016-09-28 23:13:00,trudat,0.0,0.0,0.0,0
2016-09-28 23:07:00,"Solid story, thanks for the follow",,,0.0,0
2016-09-28 23:04:00,Are hedge funds technically wrong? --Kamich,0.0,,0.0,0
2016-09-28 23:03:00,.@tim_cook Strategic deal that can move the needle to sticky enterprise sales for Apple! ($AAPL) Congratz,0.0,0.0,0.0,0
2016-09-28 23:02:00,$RDUS patch a much better answer. Why i like the stock,0.0,,0.0,0
2016-09-28 23:01:00,thank you very much!,,,0.0,0
2016-09-28 20:46:00,"Anheuser-Busch InBev: this breakout is for you, says Kamich",0.0,,0.0,0
2016-09-28 20:35:00,"Here’s a beer stock I like, read what Kamich has to say about its chart",0.0,,0.0,0
2016-09-28 19:08:00,Can Southwest keep flying high? Kamich,0.0,,0.0,0
2016-09-28 19:04:00,Wells is cheap but: Kamich,0.0,,0.0,0
2016-09-28 14:46:00,I agree with this piece about the smart money,0.0,0.0,0.0,0
2016-09-28 14:38:00,"Actually Google has made it very easy to switch to Apple. Check it out, incredibly easy..",0.0,,0.0,0
2016-09-28 13:51:00,short squeeze now--hoping for lock up expiration..,0.0,0.0,0.0,0
2016-09-28 13:51:00,Peter Lynch-One up on Wall Street,0.0,,0.0,0
2016-09-28 13:42:00,"$NKE is innovating, I am just questioning why it isn't driving N.A. sales ...",0.0,0.0,0.0,0
2016-09-28 13:41:00,"Guys you are missing all of the good ones--Frankie, US Steel, stay focused..",0.0,0.0,0.0,0
2016-09-28 13:27:00,"And a hearty congratulations to Howie Roseman, whom people doubted on the move up to Number Two in the draft! @Eagles",0.0,0.0,0.0,0
2016-09-28 13:23:00,no kidding-that's what I was saying-they should have talked about converse v. stan smith,0.0,0.0,0.0,0
2016-09-28 13:22:00,better than Lenin,0.0,0.0,0.0,0
2016-09-28 13:22:00,.@StaceyRetail thank you!,0.0,0.0,0.0,0
2016-09-28 13:12:00,Practice,,0.0,0.0,0
2016-09-28 13:11:00,Exactly---,0.0,0.0,0.0,0
2016-09-28 12:59:00,Amazon replacing FDX/UPS or augmenting: Jhonsa,0.0,,0.0,0
2016-09-28 12:43:00,RealMoney good starter primer,,0.0,0.0,0
2016-09-28 11:26:00,Plethora of A's don't forget Adobe,,0.0,0.0,0
2016-09-28 11:26:00,you bet,,0.0,0.0,0
2016-09-28 11:25:00,I don't  recall using an H. What would that be for? Home Depot?,,0.0,0.0,0
2016-09-28 11:24:00,suboptimal,0.0,0.0,0.0,0
2016-09-28 11:24:00,I only wish I were so..,,0.0,0.0,0
2016-09-28 10:48:00,You are getting it!,,0.0,0.0,0
2016-09-28 10:48:00,true,,,0.0,0
2016-09-28 08:19:00,"TV is a funny medium. I mentioned that without a job you can't afford anything, cheap or not. No need for me to remember",0.0,0.0,0.0,0
2016-09-28 08:18:00,clear minority versus those who gave it up for Wilf  @WilfredFrost,0.0,0.0,0.0,0
2016-09-27 23:00:00,"That stuff's $550 a bottle! Did someone get married or have a baby or graduate or have a birthday? Even then, no dice!",0.0,0.0,0.0,0
2016-09-27 22:58:00,suboptimal,,0.0,0.0,0
2016-09-27 22:57:00,I am such a klutz!!,,,0.0,0
2016-09-27 22:56:00,NO i said that someone could pay ten times sales for the thing but it would hurt them,,,0.0,0
2016-09-27 22:00:00,.@marceloclaure We must all be grateful for where we came and where we are allowed to live!!,0.0,0.0,0.0,0
2016-09-27 21:59:00,my favorite non-vacation week of the year!,0.0,,0.0,0
2016-09-27 21:51:00,"Hey, @WilfredFrost I finally got a seat !!!",,,0.0,0
2016-09-27 20:36:00,Present and active are totally underrated. I am not being facetious. To be in the now is dismissed way too often by people.,0.0,0.0,0.0,0
2016-09-27 20:35:00,thank you!,0.0,0.0,0.0,0
2016-09-27 20:26:00,That's why i had my cap on!!!,,,0.0,0
2016-09-27 20:24:00,Senior citizens are aghast!,,0.0,0.0,0
2016-09-27 19:16:00,Is ICE on thin ice? Kamich,0.0,0.0,0.0,0
2016-09-27 18:40:00,"I am not hungry for Hormel right now, says Kamich",0.0,0.0,0.0,0
2016-09-27 18:07:00,Upscale homebuilder Toll Brothers has a downscale chart --Kamich,0.0,0.0,0.0,0
2016-09-27 16:40:00,Learning and fun! they can go together!,0.0,0.0,0.0,0
2016-09-27 16:39:00,I love you guys!!!!,0.0,0.0,0.0,0
2016-09-27 14:43:00,Fact of life; old enough to feel tired after last night's debate but too young for someone to give up a seat! Aaargh,0.0,0.0,0.0,0
2016-09-27 13:48:00,we did it last week,,0.0,0.0,0
2016-09-27 13:48:00,$GWPH--really noodling on this,,0.0,0.0,0
2016-09-27 13:44:00,Could move the Jags to a better market...,,0.0,0.0,0
2016-09-27 13:27:00,"FAAA a note to follow....T a drink with VZ, TMUS and S!",,,0.0,0
2016-09-27 13:26:00,modern art,0.0,0.0,0.0,0
2016-09-27 13:21:00,Mexico is cheaper to buy but does take jobs... it's a real debate that I want to hear,0.0,0.0,0.0,0
2016-09-27 13:17:00,no I don]t did you listen? i don't have the answers. I want to hear the debate on it,,0.0,0.0,0
2016-09-27 13:16:00,correct which is why this is such an important issue to discuss : I don't pretend to have the answers,0.0,0.0,0.0,0
2016-09-27 13:15:00,"cheaper cars v. more jobs.. this is a very real debate. I would love to see it, hear it.",0.0,0.0,0.0,0
2016-09-27 12:51:00,I have had enough of him.,,,0.0,0
2016-09-27 07:51:00,"Honestly, can Trump's staff please find him more examples than Ford and Carrier (UTX). Stop singling them out already. $F, $UTX. Do homework",0.0,0.0,0.0,0
2016-09-27 07:48:00,"Brought to you buy Apple, say the bears...",0.0,0.0,0.0,0
2016-09-27 07:47:00,always avail,0.0,0.0,0.0,0
2016-09-27 07:46:00,The Mexican Peso declares the winner? Peso finally rallying after an amazing hammering.,0.0,0.0,0.0,0
2016-09-27 01:00:00,I am watching the debate on MSFT/DIS/CRM/GOOG/TWTR!,0.0,0.0,0.0,0
2016-09-27 00:53:00,"Samsung users: Have you ever read To Build a Fire, by Jack London? Awesome Galaxy manual",0.0,0.0,0.0,0
2016-09-27 00:51:00,The head of Samsung could call me individually and thank me for sticking with them and it wouldn't matter ..,0.0,0.0,0.0,0
2016-09-27 00:48:00,I would prefer to own a phone where I didn't need to be contacted by the maker because it didn't catch fire. But maybe I am selfish,0.0,0.0,0.0,0
2016-09-27 00:43:00,I do this for you!,,0.0,0.0,0
2016-09-26 23:58:00,Fitbit- against the gain-- Kamich,0.0,0.0,0.0,0
2016-09-26 23:53:00,Technical bank run down— we need it; Kamich,0.0,0.0,0.0,0
2016-09-26 23:50:00,Nike losing traction? Kamich asks,0.0,0.0,0.0,0
2016-09-26 23:32:00,Long-term LULU’s a winner— here’s the technical picture: Kamich,,0.0,0.0,0
2016-09-26 23:21:00,what a story this is!,0.0,0.0,0.0,0
2016-09-26 23:19:00,I said I don't like the vaccine stocks. Why in heck would i not like vaccines?,,0.0,0.0,0
2016-09-26 23:13:00,exactly right! thanks for getting me!!!,0.0,0.0,0.0,0
2016-09-26 23:11:00,"it was NOT the batteries, that's the whole point. It was the wiring..",0.0,0.0,0.0,0
2016-09-26 20:06:00,.@sacca We will see you at Dreamforce and you are heat and soul @MadMoneyOnCNBC,,0.0,0.0,0
2016-09-26 20:03:00,.@sacca When @MadMoneyOnCNBC comes out west next week will you come on and talk about this issue among other things?? It is so key...$TWTR,0.0,0.0,0.0,0
2016-09-26 19:45:00,"Again, I keep saying you have to think of $TWTR the way another outfit would not these guys...",0.0,0.0,0.0,0
2016-09-26 19:41:00,"Multiple buyers for $TWTR? Again, this is not about what Twitter looks like now it is what it could look like....",0.0,0.0,0.0,0
2016-09-26 18:34:00,Avoid this stock no matter who wins!,0.0,,0.0,0
2016-09-26 17:09:00,"I think long-term SBUX, here’s the now: Kamich",0.0,,0.0,0
2016-09-26 17:03:00,The Snub!,0.0,,0.0,0
2016-09-26 16:43:00,.@jonnajarian   this is something else!,0.0,,0.0,0
2016-09-26 16:39:00,Come into my zone.. lets see how it goes,,,0.0,0
2016-09-26 16:36:00,.@ReformedBroker  there is a fabulous rigor here. It is NOT a trading show. It is a thoughtful show about the markets,0.0,,0.0,0
2016-09-26 16:18:00,total agreement!,0.0,,0.0,0
2016-09-26 16:17:00,How much fun is @HalftimeReport -- @ScottWapnerCNBC,0.0,0.0,0.0,0
2016-09-26 15:46:00,.@ValaAfshar You approach tweeting with rigor and inspiration. I learn from each tweet and read them to my wife all of the time!,0.0,,0.0,0
2016-09-26 15:45:00,fifteen minutes to @HalftimeReport with @ScottWapnerCNBC,0.0,,0.0,0
2016-09-26 15:22:00,I learn a lot about tech AND life from following @ValaAfshar. Oldr less in tough people should truly follow his every word! $CRM!,0.0,0.0,0.0,0
2016-09-26 15:19:00,Advanced Micro Devices and the real story of short interest: Kamich,0.0,,0.0,0
2016-09-26 14:29:00,Algerian Potato Chip Minister!,,,0.0,0
2016-09-26 14:28:00,My discipline really doesn't allow me to say yes to chasing,0.0,,0.0,0
2016-09-26 13:21:00,I am not going to engage with trash talkers but I do think it is important that we understand the excitement factor which always matters,0.0,0.0,0.0,0
2016-09-26 13:14:00,I hate this kind of misunderstanding of what I say... it is so patently obvious this is not what i meant: tune in to CNBC for #Debates2016,0.0,0.0,0.0,0
2016-09-26 11:12:00,"But how about the Europe ""study"" that says sales aren't that good.",0.0,,0.0,0
2016-09-26 09:54:00,It was a glorious fall weekend: Saturday at Bucknell for Parents Weekend and Sunday at @Eagles where we took no prisoners,0.0,,0.0,0
2016-09-26 09:52:00,No need to apologize !,0.0,,0.0,0
2016-09-26 08:52:00,still watching,0.0,,0.0,0
2016-09-26 08:49:00,.@BobCarrigan Statement win!,0.0,,0.0,0
2016-09-26 08:47:00,"Deutsche Bank September surprise?? That, for once, and not oil, is weighing on the market.",0.0,0.0,0.0,0
2016-09-26 00:31:00,The Gang Celebrates!!!,0.0,0.0,0.0,0
2016-09-25 23:16:00,Safe trip home; don't forget your towels,0.0,0.0,0.0,0
2016-09-25 23:02:00,I found Big Ben,0.0,0.0,0.0,0
2016-09-25 22:59:00,Show us your Terrible Towel!,0.0,0.0,0.0,0
2016-09-25 22:52:00,Don't get cocky!!!,,,0.0,0
2016-09-25 22:38:00,Welcoming Barner to the TD club: @Eagles,0.0,0.0,0.0,0
2016-09-25 22:22:00,E A G L E S!!!,0.0,,0.0,0
2016-09-25 22:00:00,Darren Sproooooles!! @Eagles,0.0,0.0,0.0,0
2016-09-25 20:43:00,Backed up; key plays,,,0.0,0
2016-09-25 20:35:00,Come on Birds!,0.0,,0.0,0
2016-09-25 20:17:00,Statement game !,0.0,0.0,0.0,0
2016-09-25 15:07:00,Modern Family at Super Saturday Bucknell Parents Weekend!!,0.0,0.0,0.0,0
2016-09-25 13:21:00,Good observation but might not be representative of the entire chain...,,,0.0,0
2016-09-25 13:19:00,.@marceloclaure Momentary brain freeze--$S has been a huge winner!,0.0,0.0,0.0,0
2016-09-25 13:15:00,I think Parents Weekend at Bucknell was fun for everyone!!,0.0,,0.0,0
2016-09-25 13:13:00,I could not get this negative $AAPL story confirmed and am not sure it has rigor,0.0,,0.0,0
2016-09-25 13:12:00,May it be a great contest for the king of Pennsylvania...,0.0,,0.0,0
2016-09-25 12:56:00,"I was in a jam, my @Eagles helmet needed polishing so I grabbed what I could!!",0.0,0.0,0.0,0
2016-09-24 15:55:00,The great John Bravman President of Bucknell at Parents Weekend hitting it out of the park as always,0.0,0.0,0.0,0
2016-09-23 23:47:00,"as always, thank you. As you know people go out of their way to confront here. So strange. Thanks for just being a good guy",0.0,,0.0,0
2016-09-23 23:07:00,thank you so much!,,,0.0,0
2016-09-23 23:05:00,no kidding...and i can call my banker. But i am talking about being in touch from the bank's point of view for customer service.,,,0.0,0
2016-09-23 23:04:00,I debated the curse and arrived at the conclusion that we have never won a Super Bowl anyway so we are already cursed,0.0,,0.0,0
2016-09-23 21:49:00,You have only seen part one of a two part interview with $LULU,,,0.0,0
2016-09-23 21:24:00,$FB video reveal shines a light on news feed issues,0.0,,0.0,0
2016-09-23 21:11:00,I am game!,0.0,,0.0,0
2016-09-23 21:09:00,thank you kind sir!,0.0,0.0,0.0,0
2016-09-23 20:50:00,"I am liking the way tonight's @MadMoneyOnCNBC is shaling up. And of course, we have $TWTR comments.. Coming in hot!",0.0,,0.0,0
2016-09-23 19:50:00,.@Frank_Calderoni--same! Nice q from $RHT!,0.0,,0.0,0
2016-09-23 19:30:00,Unapologetic  false prophets of rate-hikes --this one's for you,0.0,,0.0,0
2016-09-23 19:28:00,Just fabulous reporting today by @davidfaber,0.0,,0.0,0
2016-09-23 19:03:00,Great to hear this! thank you,,0.0,0.0,0
2016-09-23 19:00:00,thank you so much!,,,0.0,0
2016-09-23 18:55:00,rumored stocks tend not to go right back to where they were.,,,0.0,0
2016-09-23 15:07:00,Teva: this is no generic downtrend --Kamich,0.0,,0.0,0
2016-09-23 15:00:00,Some oscillators are creeping into overbought territory: Ortmann,0.0,,0.0,0
2016-09-23 14:51:00,His piece correctly describes the current state of $TWTR but not the future state. And he is  a real good  guy.,0.0,0.0,0.0,0
2016-09-23 14:48:00,Thanks for this. people don't get being in the moment. It is everything...,0.0,,0.0,0
2016-09-23 14:30:00,".@ValaAfshar and you have taught us all how it should be viewed, which is much bigger than even management views it. Thanks so much! $TWTR",0.0,0.0,0.0,0
2016-09-23 14:08:00,FireEye chart has no visible base building-- Kamich,0.0,,0.0,0
2016-09-23 13:45:00,.@ValaAfshar YES YES YES this is how to use Twitter. Ultimate customer relations management tool. They know all about you but don't use it!,0.0,0.0,0.0,0
2016-09-23 13:41:00,.@ValaAfshar Wow-no one like you!!!!!!!!!!!!!!!!!,0.0,,0.0,0
2016-09-23 13:21:00,.@SaraEisen yes you are so right!! I know i am not a great spokesperson for mindfulness nut it is real and it matters,0.0,,0.0,0
2016-09-23 13:14:00,BINGO!,0.0,0.0,0.0,0
2016-09-23 13:12:00,.@davidfaber wow!,0.0,,0.0,0
2016-09-23 12:50:00,I had a dream that some clown couldn't  spell @Eagles and then I woke up and it was Madtrader!,0.0,,0.0,0
2016-09-23 12:48:00,"I don't like stop losses-you surrender control and I don't like ETFs, you can pick better stocks",0.0,0.0,0.0,0
2016-09-23 12:47:00,You are right. The Terrible Towel couldn't even get a shine on that helmet. What a waste. Go @Eagles,0.0,0.0,0.0,0
2016-09-23 12:46:00,The last time I was frightened was when Pop hit me for breaking a lug nut on the Mustang back in '72. So I am not really shaking.,0.0,0.0,0.0,0
2016-09-23 12:44:00,Thanks Deb!,,,0.0,0
2016-09-23 12:44:00,I was totally focused on everything you said and wrote and have changed my whole routine because of your advice.,,,0.0,0
2016-09-23 10:54:00,Keep dreaming,,,0.0,0
2016-09-23 10:53:00,My record's one and one,0.0,,0.0,0
2016-09-23 10:38:00,"We are not animals but i was just trying to help the guy. Way too many fist fights at the Linc. I know, I have been in them.",0.0,,0.0,0
2016-09-23 10:37:00,"thank you, fabulous movie. recreated it when i went to Vienna last year.",0.0,,0.0,0
2016-09-23 10:36:00,not with me,0.0,,0.0,0
2016-09-23 07:47:00,.@anthonynoto well done! Now need other team to show up,0.0,,0.0,0
2016-09-23 07:46:00,glad you caught it!,0.0,,0.0,0
2016-09-23 07:45:00,27 to nothing moves no needles,0.0,0.0,0.0,0
2016-09-23 02:52:00,"Yo, Chief, respect the house. We are not Pennsylvanians, we are Philadelphians. Stay safe: wear muted colors",0.0,,0.0,0
2016-09-23 02:39:00,".@adambain  Of course, but candidly, I got a 3:45 a.m workout tomorrow and i am starting to waver cause I only have Gost going tonight!!",0.0,,0.0,0
2016-09-23 02:33:00,".@adambain and @anthonynoto when you come on the show in two weeks we will kick all of this stuff around!. Offer on Twitter, by Twitter!!",0.0,0.0,0.0,0
2016-09-23 02:32:00,"Saw Mr. Carmichael a few weeks ago. A great man. Man did my mom love listening to him catch touchdowns on the radio.. Mike Quick, too!",0.0,0.0,0.0,0
2016-09-23 02:31:00,.@MMehtaNYDN vicious but that's why I follow you...,0.0,0.0,0.0,0
2016-09-23 02:30:00,".@adambain , @anthonynoto -free advice cause you know I like you-get someone to rate your best tweets and follows for #TNF. Name names!",0.0,0.0,0.0,0
2016-09-23 02:28:00,".@AntonioBrown we will see you at 4:25 at the Linc, on Sunday, where you will not be one of my heroes. @Eagles Take No Prisoners, Birds!!",0.0,,0.0,0
2016-09-23 02:27:00,".@adambain Here's what i like about Twitter football. I now follow hero, Antonio Brown; I didn't even know he tweeted.",0.0,0.0,0.0,0
2016-09-23 02:25:00,"that's what we've done...It is no secret who the future belongs to. But don't forget to read Youth, by Conrad, to put it all in perspective",0.0,0.0,0.0,0
2016-09-23 02:23:00,"wow, I fi only had that kind of power",0.0,,0.0,0
2016-09-23 02:23:00,.@ReginaGilgan created this team. She drafted them. She picked them. We play for her. She plays for us. @MadMoneyOnCNBC,0.0,0.0,0.0,0
2016-09-23 02:22:00,the arena's a hard place....,0.0,,,0
2016-09-23 02:21:00,"Thank you, you know we could whip those HF guys with Bezos creating the virtual market ...",0.0,,0.0,0
2016-09-23 01:33:00,"We are blessed with the greatest staff in the world , @MadMoneyOnCNBC. and we would all walk to the ends of the earth for each other!!!",0.0,0.0,0.0,0
2016-09-22 23:40:00,Will the CSCO-CRM tie up move the needle ?,0.0,,0.0,0
2016-09-22 23:27:00,Puma’s an animal: Kamich,0.0,,0.0,0
2016-09-22 22:32:00,compassion?,0.0,,0.0,0
2016-09-22 22:29:00,thank you!,0.0,,0.0,0
2016-09-22 21:59:00,We've been speculating that $IBM should buy $IMPV for ages...,0.0,0.0,0.0,0
2016-09-22 21:52:00,".@ValaAfshar simple, true position",,,0.0,0
2016-09-22 21:52:00,Some real good stuff on $LULU coming up!,0.0,,0.0,0
2016-09-22 20:27:00,.@anthonynoto Could be you are feeling the Pats' QB situation...,0.0,0.0,0.0,0
2016-09-22 20:26:00,BID matters to stocks! for.tn/2dd8H65,0.0,,0.0,0
2016-09-22 19:33:00,Deutsche Bank will not get off lightly: FillorKill,0.0,,0.0,0
2016-09-22 19:11:00,aw shucks!,,0.0,0.0,0
2016-09-22 19:10:00,tell him to rearrange his entire priorities and start focusing on the prize! Or maybe email me?,,,0.0,0
2016-09-22 19:09:00,.@carlquintanilla you have got to love this guy. He called me Mr. Cramer when i met him and treated me like i was a senior statesman!,0.0,,0.0,0
2016-09-22 19:08:00,.@brianstelter Carson Wents watches game tape like you watch news tape. He's a total junkie. @Eagles,,,0.0,0
2016-09-22 17:13:00,"I think CAT’s going higher, Kamich questions it",0.0,,0.0,0
2016-09-22 14:03:00,The IPO with the mostest!,0.0,0.0,0.0,0
2016-09-22 13:48:00,"No, I said that we can figure out ways to make money either way. I think you need to watch.. not just opine",0.0,0.0,0.0,0
2016-09-22 13:45:00,You are very kind.. thank you,0.0,0.0,0.0,0
2016-09-22 13:18:00,Kind of an important part of our ethos in the U.S.,0.0,,0.0,0
2016-09-22 12:09:00,Kite— not ready for takeoff-- Kamich,0.0,,0.0,0
2016-09-22 12:03:00,Here’s some truth about the Apple watch for.tn/2dbMoO4,0.0,0.0,0.0,0
2016-09-22 11:17:00,I already wear my ABC pants all over town from $LULU. @WilfredFrost doesn't need to wait!,0.0,,0.0,0
2016-09-22 11:14:00,contrary view...,0.0,0.0,0.0,0
2016-09-22 08:56:00,.@brentlsaunders thanks for coming on. All drug company ceos should sign your pledge! Better world...,0.0,0.0,0.0,0
2016-09-22 08:55:00,.@marceloclaure I do like your Take No Prisoners style!,,0.0,0.0,0
2016-09-22 08:54:00,"For a second I was thinking, shoot, why did i loosen my tie. I always like a crisp knot!",0.0,0.0,0.0,0
2016-09-22 08:53:00,thank you!,0.0,,0.0,0
2016-09-21 23:33:00,limited edition,,,0.0,0
2016-09-21 23:30:00,Confessions does not show me in a good light. But then again i wrote it,0.0,,0.0,0
2016-09-21 23:27:00,"you work hard, you try to get it right, but you have to be careful cause if you come on at 1:45 you gotta be right.. Just the way it works",0.0,,0.0,0
2016-09-21 23:25:00,the chart of $TWLO is pure pulchritude,0.0,,0.0,0
2016-09-21 23:24:00,"No, but i did let a whole silo of cereal drain to the floor cause I didn't position the bag right at a  Fred Meyer in Oregon!!",,,0.0,0
2016-09-21 23:21:00,So don't watch me,0.0,,0.0,0
2016-09-21 23:20:00,Thank you! All of the other pharma guys should have signed off on @brentlsaunders view!,0.0,,0.0,0
2016-09-21 23:19:00,Alphabet not winning the message war? Jhonsa,0.0,,0.0,0
2016-09-21 23:18:00,"Without a bid, where does HOG go?",0.0,,0.0,0
2016-09-21 21:47:00,".@MalcolmJenkins Man, are you ever heart and soul Philly!!!",0.0,,0.0,0
2016-09-21 19:20:00,Jeez these biotechs suddenly have game: Kamich,0.0,,0.0,0
2016-09-21 18:25:00,okay we will deal with December,0.0,,0.0,0
2016-09-21 18:11:00,Big Bad Event is over and now the buyers are in charge. They waited. No real inflation.. So no action.,0.0,0.0,0.0,0
2016-09-21 18:10:00,"Jeez, @Convertbond that was an ill-advised call that the fed would tighten. Not worth it to put out a bold call. Re-think the plan",0.0,0.0,0.0,0
2016-09-21 17:39:00,Sideways pharma: Kamich,,,0.0,0
2016-09-21 16:31:00,Another tech buyout? Kamich,0.0,,0.0,0
2016-09-21 16:04:00,Tesaro: the next to get a big bid? Kamich,,,0.0,0
2016-09-21 16:00:00,.@AdamSchefter Still thinking of starting Eli over Dak or Wentz!,0.0,,0.0,0
2016-09-21 15:59:00,"I said the Fab Five was Right!!! man that's how bad things are spread.. come on!, man!!",,,0.0,0
2016-09-21 15:58:00,More money for Apple: for.tn/2cQO95A,0.0,,0.0,0
2016-09-21 15:57:00,Did he overpay?,,,0.0,0
2016-09-21 13:55:00,This is moving Micron! bit.ly/2coFt7l,0.0,,0.0,0
2016-09-21 13:16:00,.@ValaAfshar  lots more room for $AAPL!,0.0,0.0,0.0,0
2016-09-21 12:52:00,we had a good laugh on the @MadMoneyOnCNBC set!,,,0.0,0
2016-09-21 12:51:00,coming to me in 90 seconds!,,,0.0,0
2016-09-21 09:40:00,.@SaraEisen The old playbook was a little tiresome,0.0,,0.0,0
2016-09-21 08:54:00,there's just a lot of things happening in the a.m. that must be digested before @SquawkStreet,0.0,,0.0,0
2016-09-21 08:52:00,I didn't see it. I do like George Clooney..,,0.0,0.0,0
2016-09-21 08:51:00,.@SaraEisen & .@WilfredFrost what's the lead?,,0.0,0.0,0
2016-09-21 03:06:00,The skinny on the latest addition to $FB's hardware lab,0.0,,0.0,0
2016-09-21 02:34:00,thanks for watching!,,,0.0,0
2016-09-20 23:21:00,HA!,0.0,0.0,0.0,0
2016-09-20 23:20:00,".@JohnLegere love the intensity you and Marcelo bring!! ($S, $TMUS)",0.0,0.0,0.0,0
2016-09-20 23:16:00,.@marceloclaure The pleasure was ours! thanks Marcelo!! ($S),0.0,,0.0,0
2016-09-20 23:13:00,"I thought NO ONE would recognize that. Thanks!! Honestly I was going to footnote it but figured, what the heck!",0.0,0.0,0.0,0
2016-09-20 23:11:00,We really like $FDX and $ADBEl,,,0.0,0
2016-09-20 23:11:00,you are quite welcome!,,0.0,0.0,0
2016-09-20 17:36:00,Valeant— hat in hand: #FillorKill,0.0,,0.0,0
