time,content,comments,retweets,quotes,hearts
2016-07-12 07:58:00,You are more direct. that statement cost people a great deal of money and really frightened who was ever left!,0.0,0.0,0.0,0
2016-07-12 07:57:00,"The problem with the ""bubble"" analysis of the consumer packaged goods group is i first heard it called that in 1984",0.0,,0.0,0
2016-07-12 07:56:00,Huh? Chill...,0.0,,0.0,0
2016-07-12 02:59:00,the Mad Money burger at the Hat Tavern is darned good!,0.0,,0.0,0
2016-07-12 02:56:00,"They aren't mutually exclusive, that's the point.",0.0,,0.0,0
2016-07-12 02:54:00,"No, it's a multi-year move of chronic overvaluation b/c of scarcity, not a bubble.. not the same thing...",0.0,0.0,0.0,0
2016-07-12 01:23:00,"Watch the Chinese buy Alcoa, the commodity company, because of the Bauxite shortage!",0.0,0.0,0.0,0
2016-07-12 01:22:00,$RRD guys are fabulous!! this could be big!,0.0,,0.0,0
2016-07-11 19:54:00,Prepping for $AA!,0.0,0.0,0.0,0
2016-07-11 14:40:00,Loving this $GE -$MSFT interview with @jonfortt,0.0,0.0,0.0,0
2016-07-11 13:54:00,Stop Trading coming right up!,0.0,0.0,0.0,0
2016-07-11 13:14:00,I love Italy! Take your kids and learn! Hire an historian as a guide as we did..,,0.0,0.0,0
2016-07-11 13:10:00,so fired up!!!! @SquawkStreet with @carlquintanilla and @davidfaber,0.0,0.0,0.0,0
2016-07-11 13:09:00,Just fabulous to be back with the guys!!! @SquawkStreet SO EXCITING!!!,0.0,,0.0,0
2016-07-11 12:57:00,What a VIX call he made!,0.0,,0.0,0
2016-07-11 12:56:00,Highly unusual jeans moment. Daughter blessed the outfit. Like dressing with my mother before going to school,0.0,0.0,0.0,0
2016-07-11 08:45:00,Thanks much! itching to get back today!,0.0,,0.0,0
2016-07-10 23:52:00,Here's the issue; that's the same argument we have heard for 700 points! $AMZN,0.0,0.0,0.0,0
2016-07-10 23:50:00,Can it get any better than taking your daughter to Rome for a holiday! The Forum!!,0.0,0.0,0.0,0
2016-07-10 23:47:00,Congratz on your success!!!,0.0,0.0,0.0,0
2016-07-10 23:45:00,I just re-read Get Rich Carefully and it still holds up real well.. thanks for asking!,0.0,,0.0,0
2016-07-10 12:25:00,The silver people get angry when you say you like Gold.. so how about precious metals and $GOLD,0.0,0.0,0.0,0
2016-07-10 11:52:00,People love my garden..they say they like both shows and they like our actionalerts club. It's all good!,0.0,0.0,0.0,0
2016-07-10 11:51:00,I think it will be difficult for Twitter to stay independent. The franchise is bigger than management can imagine.,0.0,0.0,0.0,0
2016-07-10 07:00:00,I wish I knew because I am in total agreement....,0.0,,0.0,0
2016-07-10 06:59:00,Employment and credit growth expanding in the U.S. Housing  stocks getting second wind,,,0.0,0
2016-07-10 06:59:00,"$AMZN not expensive for the long-term, no",0.0,0.0,0.0,0
2016-07-09 01:01:00,"YUM beating labor to the punch, you know I love this one",0.0,0.0,0.0,0
2016-07-09 00:59:00,"Fox : bad press, but good buy?",0.0,,0.0,0
2016-07-09 00:58:00,Viacom- good things could come to those who wait: Kamich,0.0,,0.0,0
2016-07-09 00:55:00,"Like Cirrus, Apple supplier Skyworks might be bottoming: Kamich",0.0,,0.0,0
2016-07-09 00:50:00,Could this Celgene drug take biz from Valeant? Just wondering.,0.0,,0.0,0
2016-07-08 16:18:00,Fundamentals be damned? Hardly!,0.0,0.0,0.0,0
2016-07-08 13:21:00,Juno— this is what happens in biotech,0.0,,0.0,0
2016-07-08 12:48:00,recession call wake-up!!! like-no,0.0,0.0,0.0,0
2016-07-07 20:33:00,GE: Where the money will really be saved! Fill or Kill,0.0,0.0,0.0,0
2016-07-07 14:13:00,Nortek: think big!,0.0,,0.0,0
2016-07-07 14:10:00,Trucks just aren't trucking,0.0,,0.0,0
2016-07-06 21:05:00,How the heck is this group back?,0.0,,0.0,0
2016-07-06 20:50:00,RF- cheap and getting cheaper!,0.0,,0.0,0
2016-07-06 20:27:00,Thanks for understanding and sticking with realmoney.com as we fix it to make it super good!,,,0.0,0
2016-07-06 20:24:00,"that's the old view, yes. The new view? Why don't you start reading again.. Many new people.",,,0.0,0
2016-07-06 20:20:00,We will do a bulletin about it. @_JackMohr,0.0,,0.0,0
2016-07-06 20:19:00,They took the hit and they fixed the joint,,,0.0,0
2016-07-06 19:03:00,Twitter’s worth more than it is selling for: here’s why,0.0,0.0,0.0,0
2016-07-06 18:15:00,Another pullback coming in Nat Gas— technical look at RRC,,,0.0,0
2016-07-06 16:30:00,Smith & Wesson— is it ever too late?,0.0,,0.0,0
2016-07-06 16:03:00,Alcoa— it is waiting too long,,,0.0,0
2016-07-06 15:29:00,The final treasury blow-off?,0.0,0.0,0.0,0
2016-07-06 15:24:00,From @BrianSozzi-- you'll never believe which is the hottest department store stock in 2016,0.0,0.0,0.0,0
2016-07-06 14:02:00,A way out for Chipotle?,0.0,0.0,0.0,0
2016-07-06 01:46:00,Much obliged!,0.0,0.0,0.0,0
2016-07-06 01:45:00,thank you!,0.0,0.0,0.0,0
2016-07-06 01:45:00,thank you so much!!,,,0.0,0
2016-07-06 01:44:00,"Hey chief, how about $GOLD, not happy with that?",0.0,,0.0,0
2016-07-05 20:13:00,thanks for this. it is not a great life.. it is really just so you can make enough money to do something else !,0.0,0.0,0.0,0
2016-07-05 20:12:00,Just used some Chicken manure actually....,0.0,0.0,0.0,0
2016-07-05 20:11:00,agree--and you could get one!!,0.0,0.0,0.0,0
2016-07-04 19:20:00,.@MichaelChiklis Oral history of The Shield is Mandatory Reading!!,0.0,0.0,0.0,0
2016-07-04 18:32:00,Bug wishes all rescue dogs a Happy Fourth of July,0.0,0.0,0.0,0
2016-07-04 18:13:00,"Guy, Happy Fourth even as it may have been more on the receiving end",,,0.0,0
2016-07-04 18:11:00,thank you! and Happy Fourth,0.0,,0.0,0
2016-07-04 16:56:00,Happy Independence Day to all!!!,0.0,,0.0,0
2016-07-03 23:05:00,"If you want to know what's the most joyous thing in life to do, try planting with your kids when they are older. Not talking, just planting",0.0,0.0,0.0,0
2016-07-03 23:00:00,"Organic fertilizer, organic spray for the leaves and ten containers of lady bugs!!",0.0,0.0,0.0,0
2016-07-03 22:59:00,We have so many fences it is ridiculous. And the main fence is set up so they know better....,0.0,,0.0,0
2016-07-03 22:58:00,endless weeding and organize fertilizer and  more weeding.,0.0,0.0,0.0,0
2016-07-03 22:58:00,I will try to give you weekly pics or at least every other week!,0.0,,0.0,0
2016-07-03 22:56:00,the garden is my love and my passion. Totally at peace. Same with my daughter,0.0,0.0,0.0,0
2016-07-03 22:56:00,We are huge canners. We make dozens of cans of tomato sauce.,0.0,0.0,0.0,0
2016-07-03 22:54:00,"Thanks for going, Dougie!!! @BarSanMiguelBK",0.0,,0.0,0
2016-07-03 22:53:00,I will do a stand for a cause!,0.0,,0.0,0
2016-07-03 22:45:00,Beefsteaks!,0.0,,0.0,0
2016-07-03 16:12:00,"Carrots, radishes, romaine and different lettuces",0.0,,0.0,0
2016-07-03 16:11:00,"Parsley sage Rosemary, you get the picture",0.0,0.0,0.0,0
2016-07-03 16:10:00,All th berries you need,0.0,0.0,0.0,0
2016-07-03 16:07:00,"Subdued onions, kale, beets, beans, and more onions",0.0,0.0,0.0,0
2016-07-03 16:07:00,Peas out of control,0.0,0.0,0.0,0
2016-07-03 16:06:00,Cukes and zukes are insane!,0.0,0.0,0.0,0
2016-07-03 16:05:00,Peppers of all kinds enjoy frolic,0.0,,0.0,0
2016-07-03 16:04:00,Can't have too many tomatoes for Cramers' None Better Sauce,0.0,,0.0,0
2016-07-03 16:03:00,Tomatoes in total bull mode,0.0,0.0,0.0,0
2016-07-02 22:05:00,thank you very much!,0.0,,0.0,0
2016-07-02 21:47:00,already has!,0.0,0.0,0.0,0
2016-07-02 21:46:00,Carlin and Kinnison,0.0,0.0,0.0,0
2016-07-02 16:13:00,The best article about movie zeitgeist ever!,0.0,,0.0,0
2016-07-02 01:42:00,To be fair to @jack he has to spend more time at Square because of their problems,0.0,,0.0,0
2016-07-01 23:52:00,Only way to play it!,0.0,,0.0,0
2016-07-01 23:51:00,Well done! you bought when the trust bought! I think people have to watch and read to know what i am thinking,0.0,,0.0,0
2016-07-01 23:21:00,thanks for tweeting!,,,0.0,0
2016-07-01 23:20:00,amen,0.0,,0.0,0
2016-07-01 23:11:00,thank you for tweeting this!,0.0,,0.0,0
2016-07-01 23:10:00,much obliged!,0.0,,0.0,0
2016-07-01 23:06:00,thank you so much for saying this!,0.0,,0.0,0
2016-07-01 21:40:00,"Oh, i am not stopping .. I am just tired of blocking and then having them come back with different names!",0.0,,0.0,0
2016-07-01 21:38:00,that's what i want--and that's what concierge service should be...,0.0,,0.0,0
2016-07-01 21:29:00,masochism....,,,0.0,0
2016-07-01 21:22:00,i like the vast majority of my followers and will not delegate this function because i want your input!,0.0,,0.0,0
2016-07-01 21:16:00,"actually most people with lots of followers like I have never look at the feed. Haters know I do,",0.0,,0.0,0
2016-07-01 21:14:00,You can't see the slew of people i just blocked again. I am going back to Twitter to figure out what's going on. Same guys I am sure!,0.0,0.0,0.0,0
2016-07-01 21:01:00,Enough,0.0,0.0,0.0,0
2016-07-01 21:00:00,Holy cow. You are right. How wrong was it. Dow up 19 points!! Sorrry!!!,0.0,0.0,0.0,0
2016-07-01 20:13:00,"I just blocked another 5. it's insane. Jeez, They go out of their way to say I hurt them. What the heck?",0.0,0.0,0.0,0
2016-07-01 20:07:00,.@ValaAfshar a fabulous Canadian museum worth going to at his house!,0.0,0.0,0.0,0
2016-07-01 20:06:00,Best week of the year for stocks!,0.0,0.0,0.0,0
2016-07-01 19:22:00,Randgold is unbelievable post Brexit. It's the best of the lot!  ($GOLD),0.0,,0.0,0
2016-07-01 19:10:00,"Not Humana, Yamana!",0.0,,0.0,0
2016-07-01 19:06:00,Conagra— go against the quant grain,0.0,,0.0,0
2016-07-01 18:40:00,"I don't want to be too self-deprecating but really, these hater masochists love my show! They watch it!!",0.0,0.0,0.0,0
2016-07-01 18:36:00,LULU— the mystery continues,0.0,,0.0,0
2016-07-01 18:25:00,I just blocked my tenth person in a row-horrible hateful lies about me. Just very unfortunate,0.0,,0.0,0
2016-07-01 16:46:00,Kamich: Get long greenbacks!,0.0,,0.0,0
2016-07-01 16:43:00,Kamich: T this one up for higher prices,0.0,,0.0,0
2016-07-01 15:03:00,"Kamich: Verizon, maybe you aint seen nothing yet",0.0,,0.0,0
2016-07-01 14:52:00,Is this the best Big Cap stock in the world?,0.0,,0.0,0
2016-07-01 13:15:00,Thank you for listening!!!!,,,0.0,0
2016-07-01 12:50:00,Coen on B.O. what will bomb this weekend,0.0,0.0,0.0,0
2016-07-01 12:42:00,there we go!!,0.0,,0.0,0
2016-07-01 12:41:00,You must be a new follower!! I think those who actually follow me know this one's not even being attacked...,,,0.0,0
2016-07-01 12:40:00,How about the ones who scared you to death?,,,0.0,0
2016-07-01 12:39:00,not if they miss the quarter,,0.0,0.0,0
2016-07-01 12:37:00,the hitting days are over. I now come in peace like Ten Bears,,,0.0,0
2016-07-01 12:01:00,Europe igniting turns us around nicely from 4:00 a.m.,,,0.0,0
2016-07-01 11:18:00,Stifel says Bausch still doing well for $VRX,,0.0,0.0,0
2016-07-01 11:13:00,the consumer is strong there. I am the only one in the media I know  who thinks like that though.,0.0,,0.0,0
2016-07-01 11:12:00,yes,0.0,0.0,0.0,0
2016-07-01 11:12:00,I like the gold stocks very much here still,0.0,0.0,0.0,0
2016-07-01 11:12:00,you are a good man but it was a little weaker than expected (China PMI),0.0,,,0
2016-07-01 11:11:00,I like twitter here. others can do so much more with it,0.0,0.0,0.0,0
2016-07-01 09:51:00,"Go read Bill Walton's biography, Back from the Dead. You will love it. Truly amazing book...",0.0,,0.0,0
2016-07-01 09:50:00,the haters are funny. Don't you love that they watch every minute of what i say? They are total masochists!!,,0.0,0.0,0
2016-07-01 09:50:00,that was a live audience... i rarely  have one so i had to put on a show!!,,,0.0,0
2016-07-01 09:47:00,Macau revenues and weak Chinese pmi weighing on things...,0.0,,0.0,0
2016-07-01 08:09:00,"Believe me, if $VRX came up with some big drugs and could raise prices and buy someone with its inverted status, well....",0.0,0.0,0.0,0
2016-07-01 08:08:00,"Flagged $VRX 130 points ago because of quality work by Citron.. Andrew Left did the research, I just studied it",0.0,,0.0,0
2016-07-01 08:01:00,"amen, it's really a club where we help each other and i have a highly restrictive charter but you don't",0.0,,0.0,0
2016-07-01 07:56:00,I should have a bunch today-cogitating on some stuff for tonight right now..,0.0,0.0,0.0,0
2016-07-01 03:03:00,you are heart and soul and i appreciate it!,0.0,0.0,0.0,0
2016-07-01 03:02:00,I blocked 40 people today just so those who think I don't engage. FORTY PEOPLE!  Oh my...,0.0,0.0,0.0,0
2016-07-01 03:01:00,much appreciated!,0.0,,0.0,0
2016-07-01 03:00:00,plus we can't reinvest the realized gains we have made... we have to send them to charity. And we have restrictions!,0.0,,0.0,0
2016-07-01 02:59:00,thank you!,,,0.0,0
2016-07-01 01:25:00,you just made my day!,0.0,,0.0,0
2016-07-01 01:01:00,"I would have quit a long time ago if i did. I do like to goad them, though! Drives em crazy!!!",0.0,,0.0,0
2016-07-01 01:01:00,thanks s much for watching!,,,0.0,0
2016-07-01 00:55:00,thrilled to be a partner !!!,0.0,,0.0,0
2016-07-01 00:55:00,same as usual,0.0,,0.0,0
2016-07-01 00:51:00,you are hilarious. And who exactly are my masters besides my wife?,0.0,,0.0,0
2016-07-01 00:46:00,There are many ways to calculate a return. I urge you to look at what you as a reader could have done v. the trust,0.0,0.0,0.0,0
2016-07-01 00:20:00,very welcome!,0.0,,0.0,0
2016-07-01 00:11:00,I love this--cause it should be a down day after this run...,0.0,,0.0,0
2016-07-01 00:09:00,tough to read through it.. where are you?,0.0,,0.0,0
2016-06-30 23:14:00,Gentile says BWLD: Growth prospects on a wing and a prayer,0.0,,0.0,0
2016-06-30 23:11:00,Tractor Supply and who is next….,,,0.0,0
2016-06-30 20:39:00,Gentile’s chillin— diary’s red hot though!,0.0,,0.0,0
2016-06-30 20:26:00,Mobileye’s got the mojo: @BruceKamich,0.0,,0.0,0
2016-06-30 19:50:00,what trumped oil..,,,,0
2016-06-30 19:49:00,thank you!,,,0.0,0
2016-06-30 19:48:00,thank you Nate. So many here today are just trying their best to be as negative and hurtful as they can be.,0.0,0.0,0.0,0
2016-06-30 19:47:00,Tiresome,,,0.0,0
2016-06-30 19:47:00,what do you think happened yesterday?,,,0.0,0
2016-06-30 19:02:00,thank you!,0.0,,0.0,0
2016-06-30 19:01:00,thank you!,,,0.0,0
2016-06-30 19:01:00,"Wish we could,. We are restricted",0.0,0.0,0.0,0
2016-06-30 19:00:00,maybe the site is wrong,0.0,,0.0,0
2016-06-30 19:00:00,A Hershey takeover bid is sweet enough to turn anything around.,0.0,0.0,0.0,0
2016-06-30 18:03:00,Here’s a girl you need to get to know better… (hint- it’s a stock),,,0.0,0
2016-06-30 17:31:00,The skinny on the LionsGate–Starz deal from Coen,,,0.0,0
2016-06-30 15:39:00,One of my fave food plays gets a technical nod,0.0,,0.0,0
2016-06-30 14:36:00,Anglo Gold Ashanti has game!,0.0,,0.0,0
2016-06-30 14:31:00,Silver- love it!,0.0,0.0,0.0,0
2016-06-30 13:45:00,It's why Twitter needs to be bought and this issue fixed...Twitter's current team can't do it,0.0,0.0,0.0,0
2016-06-30 13:44:00,$GOLD,0.0,,0.0,0
2016-06-30 13:42:00,you raise great questions...,,0.0,0.0,0
2016-06-30 12:57:00,Please trash me for talking about the downside of NAFTA. I've only blocked 12 people today!  Where's the anti-cramer mojo when you need it?,0.0,0.0,0.0,0
2016-06-30 12:56:00,Did you read the mistakes chapter in my book Get Rich Carefully? At least you didn't attack my wife. Thanks!,0.0,0.0,0.0,0
2016-06-30 12:55:00,Okay now let me have it for saying that Mexico can take our jobs. Let me have it for my wife having a job once selling for Medicis.,0.0,0.0,0.0,0
2016-06-30 12:51:00,some positives please,0.0,,,0
2016-06-30 12:12:00,i think that's very harsh and unnecessary,0.0,0.0,0.0,0
2016-06-30 12:12:00,i welcome the bull case on $VRX. would be excellent counterpoint to the negativity. Gastro? Eyes? share away please?,0.0,0.0,0.0,0
2016-06-30 12:11:00,"Bill in Shanghai, I am happy to report any good news involving $VRX --can you share some with me?",0.0,,0.0,0
2016-06-30 12:00:00,Great work as always,0.0,,0.0,0
2016-06-30 12:00:00,Oh goodie! tell me what they are selling,,,0.0,0
2016-06-30 11:06:00,Now looking at gastro and $VRX,0.0,,0.0,0
2016-06-30 11:06:00,why don't the $VRX buyers just say they've been had?,0.0,0.0,0.0,0
2016-06-30 11:04:00,the vociferous nature of the $VRX fans is frightening because they never mention the debt side.,0.0,0.0,0.0,0
2016-06-30 11:04:00,"The tiresome thing about Twitter, including attacks on my wife, is that I could give a &)*) about VRX. I am just doing my job",0.0,0.0,0.0,0
2016-06-30 11:03:00,For those who like certain stocks like $VRX I am not going to change your mind. So please move on.,0.0,,0.0,0
2016-06-30 08:49:00,"If oil is in control, as it was yesterday, then we need to punch through $50 or revisit yesterday's lower prices",0.0,,0.0,0
2016-06-30 01:57:00,"arithmetically challenged-$BAC buying $5 billion of $135b company, $C buying $8.6 billion of $123 billion company",0.0,0.0,0.0,0
2016-06-30 01:48:00,"that piece took forever, thanks so much",0.0,,0.0,0
2016-06-30 01:47:00,People can mess with me all they want but it is kind of a Taken situation if you mess with my wife.,0.0,0.0,0.0,0
2016-06-30 01:46:00,try 20 years ago,,,0.0,0
2016-06-30 01:45:00,Actually it's ULTA and if you think i did badly on ULTA do not follow me,0.0,0.0,0.0,0
2016-06-30 01:44:00,thank you....The issue with Valeant is not that my wife worked for Medicis in the 90s. It's $30 billion in debt,0.0,,0.0,0
2016-06-30 01:00:00,$VRX has balance sheet issues. I would leave my wife out of it as Medicis was independent when she retired,0.0,0.0,0.0,0
2016-06-30 00:58:00,My wife left Medicis long before it was acquired by Valeant. I think the $31 billion in debt is what matters.,0.0,,0.0,0
2016-06-30 00:52:00,good programming! HA!,,,0.0,0
2016-06-29 23:08:00,Acuity— next move? Ask the diary of @JamesMGentile,0.0,,0.0,0
2016-06-29 22:58:00,"the market did fall 1.5% after the special so, empirically, no",0.0,0.0,0.0,0
2016-06-29 21:39:00,I do my best!,0.0,,0.0,0
2016-06-29 21:39:00,it's no $C,0.0,,0.0,0
2016-06-29 21:28:00,"Pershing Square, read it and… get clobbered",,,0.0,0
2016-06-29 21:03:00,"www.actionalertspluscom's Citigroup, $C so far best in show. much bigger boost than $BAC div and buyback",0.0,,0.0,0
2016-06-29 20:08:00,A weird winner in the Middle East,0.0,,0.0,0
2016-06-29 17:21:00,Here’s the truth about the British banks,0.0,0.0,0.0,0
2016-06-29 17:18:00,Bausch & Lomb’s lost value and Valeant,0.0,0.0,0.0,0
2016-06-29 17:04:00,A Brexit good guy?,0.0,0.0,0.0,0
2016-06-29 14:56:00,Great trading! realmoneypro.com -just made the cost of a sub ten times over!,0.0,0.0,0.0,0
2016-06-29 14:16:00,A brilliant piece on Brexit and UK film biz,0.0,0.0,0.0,0
2016-06-29 13:52:00,"$FB, $AMZN, $NFLX, ??? solve for ???",0.0,,0.0,0
2016-06-29 13:50:00,$NVDA--high speed graphics,0.0,0.0,0.0,0
2016-06-29 13:43:00,I am losing faith in a guy who calls himself Gofer as in go for a cup of coffee will you? Black no sugar,0.0,0.0,0.0,0
2016-06-29 12:53:00,I am a V.O. Key guy!,0.0,0.0,0.0,0
2016-06-29 12:51:00,pass,,0.0,0.0,0
2016-06-29 12:51:00,thanks!,,,0.0,0
2016-06-29 12:50:00,Sprite idea!,0.0,,0.0,0
2016-06-29 12:50:00,$AA split very good,0.0,,0.0,0
2016-06-29 08:14:00,thanks so much!,0.0,,0.0,0
2016-06-29 08:14:00,"Nice to see crude back in charge. Now let's see if $RBS, $LYG and $BCS can rally.",0.0,0.0,0.0,0
2016-06-29 02:31:00,amen and i will see you at 4:30 am,0.0,,0.0,0
2016-06-29 02:31:00,"Anyway, I don't defend the EU and i don't defend Lenny. I am just saying what i see and hear.And tomorrow back to stocks, period",0.0,0.0,0.0,0
2016-06-29 02:29:00,"He made many singles, day after day after day. No one big trade. That's not how he did it. But it doesn't matter...",0.0,,0.0,0
2016-06-29 02:29:00,Why doesn't Germany borrow $500 billion for nothing and put people to work!,0.0,0.0,0.0,0
2016-06-29 02:28:00,I just don't want people to lose their jobs because the remain camp was so clueless about how to help its own...,0.0,0.0,0.0,0
2016-06-29 02:27:00,"And for the record, I think I am the only person on tv who has ever said a bad word about Merkel and Germany v. the regular people",0.0,0.0,0.0,0
2016-06-29 02:25:00,I don't like the EU. I think it is tyrannical.. But you need to deal with it in a smart way. Not hurt yourself!,0.0,,0.0,0
2016-06-29 02:25:00,"facts are meaningless to many... there's not TWTR jail or Twitter prosecutor or even arbiter, so it doesn't matter",0.0,,0.0,0
2016-06-29 02:23:00,well done!,0.0,0.0,0.0,0
2016-06-29 02:23:00,didn't see it. will catch it on pay per view I guess,,,0.0,0
2016-06-29 02:22:00,I have gone over years of Lenny's trading records and they were very strong. But no one cares about that,0.0,0.0,0.0,0
2016-06-29 02:22:00,People will soon forget the need to be independent so to speak and ask why the state can't help them eat. Jobs matter! Dinner matters!,0.0,0.0,0.0,0
2016-06-29 02:21:00,"Look on Brexit, the ""remain"" camp were fools; read what i write. It's all there. They were catastrophically stupid in explaning",0.0,0.0,0.0,0
2016-06-29 02:20:00,of course it wasn't just about money but how about jobs lost and putting food on table?,0.0,,0.0,0
2016-06-29 02:20:00,I am glad you believe that; it will help when so many are thrown out of work to remember that,0.0,0.0,0.0,0
2016-06-29 02:17:00,"The late editor of thestreet.com, Dave Morrow, chronicled his trading records and he did very well",0.0,0.0,0.0,0
2016-06-29 00:16:00,Here’s a tech stock not done going higher !,0.0,0.0,0.0,0
2016-06-28 22:29:00,thanks so much!,0.0,,0.0,0
2016-06-28 22:28:00,Thank you! b./c I said Brexit hurt the world's economies lots of people are now distorting things i say and write,,,0.0,0
2016-06-28 22:27:00,I like this!!!,0.0,,0.0,0
2016-06-28 21:52:00,Agreed!!,,,0.0,0
2016-06-28 21:52:00,WOW!,0.0,,0.0,0
2016-06-28 21:51:00,Certainly liquid gold!,0.0,,,0
2016-06-28 21:51:00,Brexit,0.0,,0.0,0
2016-06-28 21:48:00,The Trust bought some at $75 what are you talking about?,0.0,0.0,0.0,0
2016-06-28 21:47:00,".@tomkeene thanks, Tom. Civility is in short supply here!",0.0,,0.0,0
2016-06-28 20:40:00,Coach— like it technically and fundamentally,0.0,,0.0,0
2016-06-28 20:12:00,"Credit Suisse: no credit, yet",,,0.0,0
2016-06-28 19:53:00,thank you so much!! You made my day!,0.0,,0.0,0
2016-06-28 16:56:00,How SolarCity could be Tesla's 'kryptonite',0.0,,0.0,0
2016-06-28 16:55:00,Walmart won't quit!,,0.0,0.0,0
2016-06-28 15:48:00,Beware of the super-cycle: $AAPL,0.0,0.0,0.0,0
2016-06-28 14:20:00,Trashing trucks on a Brexit,0.0,0.0,0.0,0
2016-06-28 14:13:00,"Bad to be back, Lloyd",0.0,,0.0,0
2016-06-28 14:13:00,Sophisticated gameplan from @JamesMGentile for this challenging time,0.0,,0.0,0
2016-06-28 14:11:00,Here’s a Brexit winner,0.0,,0.0,0
2016-06-28 13:09:00,"A great dad, a fabulous grandfather",0.0,,0.0,0
2016-06-28 13:00:00,Put us on-we ramping ; @SquawkStreet,0.0,,0.0,0
2016-06-28 08:06:00,Amazing that there could be so many people here who can't do the arithmetic of this disaster. It's pretty easy to calculate!,0.0,0.0,0.0,0
2016-06-28 08:05:00,They had a lot more to lose than their alleged chains.,,,0.0,0
2016-06-28 08:04:00,Often wrong...not much in doubt...,0.0,,0.0,0
2016-06-28 08:04:00,Actually I was being polite using the word xenophobe!,0.0,,0.0,0
2016-06-28 08:03:00,Some good names that are working.,,,,0
2016-06-28 08:03:00,much obliged!,0.0,,0.0,0
2016-06-28 08:02:00,"sadly, that's frequently the sign of a short-term bottom.",0.0,,0.0,0
2016-06-28 08:02:00,"Mind-boggling, isn't it?",0.0,,0.0,0
2016-06-28 01:21:00,thank you! Isn't it amazing how people just seem to revel in being uninformed?,0.0,0.0,0.0,0
2016-06-27 23:57:00,my bad,0.0,,0.0,0
2016-06-27 23:55:00,"this, my friend, is truly hilarious. and shows that you know absolutely nothing about me",,0.0,0.0,0
2016-06-27 21:07:00,An industrial worth buying,0.0,,0.0,0
2016-06-27 21:05:00,Nike and Brexit- no panic!,0.0,0.0,0.0,0
2016-06-27 21:00:00,the lead of tonight's show! @MadMoneyOnCNBC,0.0,0.0,0.0,0
2016-06-27 20:48:00,Big weak dollar play but i like the way you are thinking!,,,0.0,0
2016-06-27 20:46:00,That stuff attracts bees!,,,0.0,0
2016-06-27 20:10:00,Getting there. Starting to see some things developing that intrigue,0.0,,0.0,0
2016-06-27 18:31:00,"One of my faves, big buyback— secular winner",0.0,,0.0,0
2016-06-27 18:24:00,Amazon- a bright spot for when the selling ends,0.0,0.0,0.0,0
2016-06-27 16:42:00,maybe,0.0,0.0,0.0,0
2016-06-27 16:42:00,what a fabulous celebration for my daughter's graduation!,0.0,,0.0,0
2016-06-27 16:42:00,all  over it for tonight and in realmoney.com,,,0.0,0
2016-06-27 16:41:00,Taking a break from the depressing market to point out that the cucumbers are insane!! Pickles will be fabulous!!,0.0,0.0,0.0,0
2016-06-27 12:44:00,worth asking but I think deal is okay.,,0.0,0.0,0
2016-06-27 12:09:00,Losses nonetheless bro,0.0,,0.0,0
2016-06-27 12:08:00,If oil rallies than yes,0.0,,0.0,0
2016-06-27 11:52:00,Insane biotech shorts but so far understandable as group's been nightmarish.,0.0,,0.0,0
2016-06-27 11:49:00,The costs to the British people will be much larger than they understand. MUCH-calculations coming up realmoney.com,0.0,0.0,0.0,0
2016-06-27 11:35:00,"True, sorry, sometimes the blatant lies truly are too much",0.0,,0.0,0
2016-06-27 11:35:00,Need to see the blood first..,0.0,0.0,0.0,0
2016-06-27 11:21:00,Fabulous time with my family on my daughter's  graduation party this weekend so i don't mind the hard work,,,0.0,0
2016-06-27 11:21:00,thank you!,,,0.0,0
2016-06-27 11:19:00,"Actually i did, pretty good record despite distortions.. Why don't you Google my comments...",0.0,,0.0,0
2016-06-27 11:19:00,Could it have been mort stupid economically? Highly doubtful...,0.0,0.0,0.0,0
2016-06-27 11:18:00,Coming back on @TODAYshow to talk about your money...direct impact,0.0,0.0,0.0,0
2016-06-27 09:15:00,much obliged--will try to put it in context on @TODAYshow,0.0,,0.0,0
2016-06-27 09:15:00,you are very kind...,0.0,,0.0,0
